{
  "schemaVersion": "3.0.0",
  "sourceId": "official.lanairapp",
  "sourceName": "LanAirApp Official Market",
  "generatedAt": "2026-09-16T12:21:12.6503839+00:00",
  "contracts": [
    {
      "id": "LanMountainDesktop.SharedContracts.SampleClock",
      "version": "2.0.0",
      "assemblyName": "LanMountainDesktop.SharedContracts.SampleClock.dll",
      "downloadUrl": "https://raw.githubusercontent.com/wwiinnddyy/LanAirApp/main/airappmarket/contracts/LanMountainDesktop.SharedContracts.SampleClock/2.0.0/LanMountainDesktop.SharedContracts.SampleClock.dll",
      "sha256": "0b0d31c904e78a22aa982170a626e032bbfc986288fb52ddf3d195a05e782104",
      "packageSizeBytes": 4608
    }
  ],
  "plugins": []
}
